question,answer
"Ciao!, salve","Ciao! Benvenuto nel chatbot post-vendita di Morato Grop, come possiamo aiutarla?"
Il pane è arrivato ammuffito prima della scadenza,Interrompere l’uso del prodotto e conservare le prove fotografiche per riferimento futuro
Grazie mille, Di nulla siamo per qualsiasi dubbio siamo a tua disposizione
Ho ricevuto il prodotto sbagliato come posso sostituirlo,Segnalare l’errore con i dettagli dell’ordine e utilizzare le istruzioni per la gestione interna del prodotto
La confezione del pane è arrivata danneggiata,Annotare il danno e gestire il prodotto secondo le linee guida interne per sicurezza e qualità
Il pane si secca troppo velocemente consigli per la conservazione,Conservare in sacchetti ben sigillati in luogo fresco asciutto
Ho trovato un corpo estraneo nella confezione come procedere,Isolare il prodotto e registrare tutte le informazioni disponibili per sicurezza
Il prodotto ha un sapore diverso dai lotti precedenti perché,Controllare le note di produzione e verificare eventuali differenze naturali tra i lotti
Il pane non tosta uniformemente come migliorare,Verificare la temperatura e il tempo di tostatura secondo le istruzioni sulla confezione
I panini si rompono durante l’affettatura come prevenire,Affettare con attenzione e conservare correttamente il prodotto
Il prodotto è arrivato congelato mentre doveva essere fresco come risolvere,Verificare condizioni di trasporto e seguire le linee guida interne per gestione del prodotto
Il prodotto non soddisfa le aspettative dei clienti come dare feedback,Registrare le osservazioni e utilizzare i protocolli di assistenza interna
La confezione era aperta alla consegna come gestirlo,Segnalare la situazione e procedere secondo le linee guida per sicurezza del prodotto
Il prodotto ha causato problemi di allergeni come risolvere,Controllare le etichette e gestire il prodotto seguendo le procedure interne
I valori nutrizionali differiscono da quelli attesi spiegazioni,Verificare le informazioni ufficiali sulle etichette e registrare eventuali discrepanze
Il prodotto non rispetta i controlli qualità interni passo successivo,Isolare il prodotto e seguire la procedura di controllo qualità
Il pane non è consistente tra i lotti come viene gestito,Registrare le osservazioni e verificare la conformità con le specifiche
Il prodotto non dura abbastanza in esposizione buone pratiche,Conservare in luogo fresco asciutto e controllare regolarmente la qualità
I panini si deformano durante il trasporto ci sono opzioni più resistenti,Verificare le linee guida per trasporto e selezionare prodotti adatti
Il pane è arrivato senza documentazione può essere reinviata,Verificare il lotto e recuperare la documentazione mancante secondo le procedure interne
Il prodotto non è adatto alle nostre attrezzature consigli,Verificare compatibilità e seguire le linee guida di utilizzo
Il design della confezione è cambiato senza preavviso perché,Controllare aggiornamenti sulla produzione e sulla documentazione
Il pane non rispetta i requisiti del mercato locale può essere adattato,Verificare le specifiche e gestire secondo le procedure interne
Il pane è troppo salato come ridurre il gusto,Usare in ricette o tagliare fette sottili per mitigare il sapore
Il pane è troppo secco come migliorare la conservazione,Conservare in sacchetti sigillati e in luogo fresco asciutto
Il pane è troppo morbido per la tostatura come procedere,Adattare il tempo di tostatura secondo le istruzioni
Il pane ha un cattivo/brutto/strano odore, Ti consiglio di non consumarlo
I panini si sbriciolano troppo durante l’uso,Conservare correttamente e manipolare con cura
Il prodotto contiene ingredienti diversi da quelli indicati,Controllare l’etichetta ufficiale e registrare le differenze
La data di scadenza è troppo ravvicinata,Verificare il lotto e le condizioni di consegna
Il pane ha un odore strano come comportarsi,Interrompere l’uso e seguire le procedure di sicurezza
La consistenza del prodotto è diversa dai precedenti,Registrare le osservazioni e confrontare con le specifiche
Il prodotto è arrivato in ritardo rispetto alla consegna prevista,Verificare le condizioni logistiche e registrare l’anomalia
Il pane si attacca tra le fette come evitare,Conservare in luogo asciutto e ben sigillato
Le fette sono troppo sottili o troppo spesse,Verificare la linea di prodotto e le specifiche di taglio
Il prodotto è arrivato schiacciato durante il trasporto,Documentare il danno e gestire secondo le linee guida
I panini sono più piccoli del normale la ricetta è cambiata,Controllare la documentazione di produzione e le note sui lotti
Il pane non mantiene la freschezza come prima,Conservare secondo le linee guida sulla confezione
Il pane assorbe troppa umidità dal ripieno soluzioni,Conservare separatamente o seguire le linee guida di utilizzo
Il prodotto non è idoneo per la nostra ristorazione come procedere,Verificare la compatibilità e gestire secondo le procedure interne
Il pane ha un gusto strano dopo il congelamento,Seguire le istruzioni di conservazione e scongelamento
Le fette di pane non si separano facilmente come fare,Conservare correttamente e manipolare con cura
Il prodotto contiene semi non indicati in etichetta,Segnalare discrepanza e seguire le procedure interne
Il pane non è adatto alla macchina per affettare come risolvere,Usare attrezzature compatibili e seguire le istruzioni
I panini collassano quando farciti ci sono alternative,Usare prodotti adatti secondo le linee guida B2B
Il prodotto non si cuoce uniformemente come migliorare,Seguire tempi e temperatura indicati sulla confezione
La crosta del pane è troppo dura o troppo morbida,Seguire indicazioni di conservazione e tostatura
Il pane ha una forma irregolare rispetto alla normale produzione,Considerare variabilità naturale della produzione
Il prodotto è arrivato con parti ammuffite,Non consumare e seguire le procedure di sicurezza
Il pane è arrivato troppo secco cosa fare,Conservare in sacchetti ben chiusi in luogo fresco e asciutto
Il pane si è ammuffito rapidamente dopo apertura,Non consumare e conservare correttamente le fette rimanenti
I panini si rompono quando li taglio,Affettare con attenzione e conservare correttamente
Il pane ha un sapore amaro come risolvere,Verificare lotto e ingredienti e usare solo per ricette adatte
Il pane non mantiene fragranza,Conservare in sacchetti sigillati e in luogo asciutto
Le fette si attaccano tra loro,Separare le fette e conservare in modo corretto
Il pane si sfalda facilmente,Manipolare delicatamente e conservare correttamente
Il pane ha consistenza diversa tra lotti,Verificare lotto e usare secondo le linee guida
Il pane si asciuga troppo velocemente,Chiudere bene la confezione e conservare in luogo fresco
Il pane ha crosta troppo dura come ammorbidirla,Seguire istruzioni di tostatura o riscaldamento
Il pane è troppo umido dentro,Conservare in luogo fresco e asciutto
Il prodotto ha odore sgradevole,Non consumare e segnalare internamente il lotto
Le fette non sono uniformi,Verificare il lotto e utilizzare secondo le specifiche
Il pane è arrivato schiacciato,Documentare il danno e gestire secondo le linee guida interne
Il pane è troppo salato per i nostri gusti,Usare in ricette dove il sale è necessario o tagliare fette sottili
Il pane è arrivato con muffa superficiale,Non consumare e seguire le procedure di sicurezza
Il pane è troppo morbido per essere tostato,Regolare tempo e temperatura di tostatura
Il pane ha odore strano dopo apertura,Non consumare e verificare le condizioni di conservazione
Il pane si rompe durante il trasporto,Documentare il danno e gestire secondo le linee guida
Il pane è troppo compatto,Seguire le indicazioni di conservazione e cottura
Il pane si attacca alle pareti della confezione,Separare le fette e conservare correttamente
Il pane ha parti bruciate,Verificare lotto e usare solo le parti sane
I panini si deformano durante il trasporto,Verificare imballaggio e linee guida di trasporto
Il pane si raffredda troppo velocemente,Conservare in sacchetti sigillati
Il pane perde fragranza dopo l’apertura,Chiudere bene e conservare in luogo fresco
Il pane ha colore diverso dal solito,Verificare lotto e linee guida di produzione
I panini hanno sapore diverso tra lotti,Verificare ingredienti e lotto
Il pane si secca troppo rapidamente,Chiudere bene e conservare in luogo fresco
Il pane si attacca tra fette dopo apertura,Separare le fette e conservare in sacchetto
Il pane è troppo duro per affettare,Affettare con cura e seguire istruzioni di conservazione
Il pane ha sapore acido,Non consumare e segnalare internamente
Il pane non è uniforme tra pezzi,Considerare variabilità naturale e usare normalmente
Il pane è arrivato piegato,Documentare il danno e usare secondo le linee guida
Il pane è troppo molle,Seguire le linee guida di conservazione
Il pane ha sapore di bruciato,Verificare lotto e controllare cottura
Il pane non è adatto a certe preparazioni,Usare prodotti adatti secondo le istruzioni
Il pane si rompe facilmente durante l’uso,Conservare correttamente e manipolare con cura
Il pane è troppo duro per la masticazione,Tagliare fette sottili o tostare leggermente
Il pane perde aroma rapidamente,Conservare in sacchetti ben chiusi
Il pane contiene semi non indicati,Segnalare discrepanza e seguire linee guida
Il pane non si mantiene fragrante,Chiudere bene e conservare in luogo fresco
Il pane ha odore diverso tra lotti,Verificare condizioni di produzione e lotto
Il pane è arrivato troppo freddo,Verificare temperatura di trasporto e usare seguendo linee guida
Il pane non soddisfa le aspettative di qualità,Documentare e gestire secondo le procedure interne
Il pane è troppo salato per bambini,Tagliare fette sottili o usare in ricette
Il pane si attacca alle superfici del contenitore,Separare le fette e conservare correttamente
Il pane non si tosta bene,Regolare tempo e temperatura di tostatura
Il pane ha consistenza troppo friabile,Manipolare delicatamente e conservare correttamente
Il pane ha gusto leggermente diverso dal precedente,Verificare lotto e ingredienti
Il pane si sfalda quando lo affetto,Affettare con cura e conservare correttamente
Il pane è arrivato con muffa interna,Non consumare e seguire le linee guida di sicurezza
Il pane è arrivato con crosta dura,Seguire istruzioni di conservazione e tostatura
Il pane è troppo morbido dopo scongelamento,Riscaldare leggermente secondo le istruzioni
Il pane si sfalda dopo la cottura,Manipolare con cura e seguire linee guida
Il pane non mantiene fragranza dopo scongelamento,Conservare in sacchetti ben chiusi e riscaldare prima dell’uso
Il pane ha odore insolito dopo apertura,Non consumare e seguire le procedure di sicurezza
Il pane si deforma durante il trasporto,Documentare e seguire linee guida interne
Il pane è troppo secco per preparazioni,Utilizzare in ricette dove serve pane secco o tostarlo leggermente
Il pane è troppo salato per le ricette,Tagliare fette sottili o usare in ricette salate
Il pane contiene ingredienti inaspettati,Controllare etichetta e seguire linee guida interne
Il pane si attacca alla confezione,Separare le fette e conservare correttamente
Il pane ha colore diverso dal normale,Verificare lotto e seguire linee guida interne
Il pane è troppo compatto per affettare,Affettare con attenzione usando attrezzatura adeguata
Il pane si sfalda facilmente durante tostatura,Tostare a temperatura corretta e manipolare con cura
Il pane ha consistenza irregolare tra pezzi,Considerare variabilità naturale e usare normalmente
Il pane si asciuga troppo velocemente dopo apertura,Chiudere bene la confezione e conservare in luogo fresco
Il pane ha odore leggermente acido,Non consumare e seguire linee guida di sicurezza
Il pane non è uniforme nella forma,Considerare variabilità naturale della produzione
Il pane si rompe durante affettatura,Affettare delicatamente e conservare correttamente
Il pane è troppo molle per tostatura,Regolare tempo e temperatura di tostatura
Il pane ha sapore diverso tra lotti,Verificare lotto e ingredienti
Il pane contiene semi diversi dal previsto,Segnalare discrepanza e seguire procedure interne
Il pane non mantiene fragranza dopo apertura,Chiudere bene e conservare in luogo fresco
Il pane si attacca tra fette,Separare le fette e conservare correttamente
Il pane è troppo duro per masticazione,Tagliare fette sottili o tostare leggermente
Il pane è arrivato schiacciato,Documentare il danno e seguire linee guida
Il pane ha sapore amaro,Verificare lotto e ingredienti e usare solo in ricette appropriate
Il pane si deforma durante la cottura,Verificare temperatura e tempi indicati sulla confezione
Il pane è troppo umido,Conservare in luogo fresco e asciutto
Il pane ha odore strano dopo scongelamento,Non consumare e seguire procedure interne
Il pane perde aroma rapidamente,Chiudere bene e conservare correttamente
Il pane si rompe durante il trasporto,Documentare il danno e seguire linee guida
Il pane ha crosta troppo dura o troppo morbida,Regolare tostatura e conservazione
Il pane è arrivato con muffa,Non consumare e seguire procedure di sicurezza
Il pane è troppo salato per bambini,Tagliare fette sottili o usare in ricette
Il pane ha consistenza troppo friabile,Manipolare delicatamente e conservare correttamente
Il pane non si cuoce uniformemente,Verificare tempo e temperatura di cottura
Il pane si attacca alle superfici,Separare le fette e conservare correttamente
Il pane ha sapore diverso dal solito,Verificare lotto e ingredienti
Il pane non è adatto alle macchine per affettare,Usare attrezzature compatibili e seguire istruzioni
I panini collassano quando farciti,Usare prodotti adatti secondo le linee guida B2B
Il pane perde freschezza rapidamente,Chiudere bene e conservare in luogo fresco
Il pane ha odore diverso tra lotti,Verificare condizioni di produzione e lotto
Il pane si sfalda quando lo si tosta,Regolare tempo e temperatura di tostatura
Il pane è troppo compatto,Affettare con cura e seguire istruzioni di conservazione
Il pane si rompe facilmente,Manipolare delicatamente e conservare correttamente
Il pane ha parti bruciate,Verificare lotto e usare solo le parti sane
Il pane non soddisfa aspettative di qualità,Registrare osservazioni e gestire secondo linee guida interne
Il pane ha crosta troppo dura per masticazione,Tagliare fette sottili o tostare leggermente
Il pane si attacca alle pareti del contenitore,Separare le fette e conservare correttamente
Il pane non si mantiene fragrante,Conservare in sacchetti ben chiusi
Il pane ha consistenza diversa dai precedenti lotti,Verificare lotto e ingredienti
Il pane è troppo morbido,Seguire linee guida di conservazione
Il pane ha odore sgradevole,Non consumare e seguire procedure interne
Il pane si raffredda troppo velocemente,Conservare in sacchetti ben chiusi e in luogo fresco
Il pane è arrivato con pezzi mancanti,Verificare lotto e seguire linee guida interne
Il pane è troppo duro per affettare,Affettare con cura e usare attrezzature adeguate
Il pane ha odore strano dopo trasporto,Non consumare e seguire linee guida interne
Il pane si asciuga troppo velocemente,Chiudere bene e conservare in luogo fresco
Il pane ha sapore insolito dopo scongelamento,Seguire istruzioni di scongelamento e conservazione
Il pane si attacca tra fette dopo scongelamento,Separare le fette e conservare correttamente
Il pane ha odore diverso dopo apertura,Verificare conservazione e manipolare correttamente
Il pane è troppo secco per ricette,Usare in ricette che richiedono pane secco o tostarlo leggermente
Il pane ha odore acido dopo apertura,Non consumare e seguire linee guida di sicurezza
Il pane ha consistenza diversa tra i lotti,Verificare lotto e specifiche
Il pane si rompe durante trasporto,Documentare e seguire procedure interne
Il pane è troppo morbido per preparazioni,Regolare tempo e temperatura di tostatura
Il pane ha gusto diverso dal precedente,Verificare lotto e ingredienti
Il pane contiene ingredienti non dichiarati,Segnalare discrepanza e seguire procedure interne
Il pane non mantiene fragranza dopo scongelamento,Chiudere bene e conservare correttamente
Il pane ha consistenza troppo friabile dopo apertura,Manipolare delicatamente e conservare correttamente
Il pane è arrivato danneggiato,Documentare il danno e seguire linee guida interne
Il pane ha odore insolito dopo trasporto,Non consumare e seguire procedure di sicurezza
Il pane si sfalda durante cottura,Regolare tempo e temperatura di cottura
Il pane è troppo duro per la masticazione,Tagliare fette sottili o tostare leggermente
Il pane perde fragranza velocemente,Conservare in sacchetti chiusi e in luogo fresco
Il pane si attacca alle fette dopo apertura,Separare e conservare correttamente
Il pane ha crosta troppo morbida,Seguire istruzioni di tostatura e conservazione
Il pane si sfalda facilmente,Manipolare con cura e conservare correttamente
Il pane ha sapore amaro dopo scongelamento,Verificare lotto e usare solo in ricette adatte
Il pane si deforma durante trasporto,Documentare e seguire linee guida interne
Il pane non è uniforme tra pezzi,Considerare variabilità naturale e usare normalmente
Il pane ha odore sgradevole,Non consumare e seguire le linee guida di sicurezza
Il pane si sbriciola quando lo affetto,Affettare con cura e conservare correttamente
Il pane non mantiene aroma dopo scongelamento,Chiudere bene e conservare in luogo fresco
Il pane ha crosta troppo dura per la masticazione,Tagliare fette sottili o tostare leggermente
Il pane è arrivato piegato durante il trasporto,Documentare il danno e seguire procedure interne
Il pane ha gusto diverso dal solito,Verificare lotto e ingredienti
Il pane è troppo molle per tostatura,Regolare tempo e temperatura
Il pane ha odore acido,Non consumare e seguire le procedure interne
Il pane si attacca alla confezione,Separare le fette e conservare correttamente
Il pane è arrivato con fette mancanti,Verificare lotto e gestire secondo le linee guida
Il pane si rompe durante la cottura,Verificare temperatura e tempi di cottura
Il pane ha consistenza troppo dura,Affettare con cura e usare correttamente
Il pane si asciuga troppo rapidamente,Chiudere bene e conservare in luogo fresco
Il pane ha sapore amaro,Verificare lotto e usare solo in ricette adatte
Il pane non è uniforme tra fette,Considerare variabilità naturale della produzione
Il pane si attacca tra le fette,Separare e conservare correttamente
Il pane è troppo compatto,Affettare con cura e seguire istruzioni
Il pane perde fragranza velocemente,Chiudere bene e conservare correttamente
Il pane ha odore strano dopo apertura,Non consumare e seguire linee guida di sicurezza
Il pane si sfalda facilmente durante tostatura,Regolare temperatura e manipolare con cura
Il pane è arrivato schiacciato,Documentare il danno e seguire linee guida
Il pane ha crosta troppo morbida,Seguire istruzioni di conservazione e tostatura
Il pane si rompe facilmente,Manipolare delicatamente e conservare correttamente
Il pane contiene ingredienti non dichiarati,Segnalare discrepanza e seguire procedure interne
Il pane non mantiene fragranza dopo apertura,Chiudere bene e conservare in luogo fresco
Il pane si deforma durante il trasporto,Documentare e seguire procedure interne
Il pane è troppo secco,Usare in ricette o tostarlo leggermente
Il pane ha odore sgradevole,Non consumare e seguire linee guida di sicurezza
Il pane si attacca tra fette dopo scongelamento,Separare e conservare correttamente
Il pane ha consistenza irregolare tra lotti,Verificare lotto e usare normalmente
Il pane si sfalda durante affettatura,Affettare con cura e conservare correttamente
Il pane è arrivato con muffa interna,Non consumare e seguire procedure di sicurezza
Il pane non tosta uniformemente,Regolare tempo e temperatura
Il pane ha sapore diverso dai lotti precedenti,Verificare lotto e ingredienti
Il pane è troppo morbido,Seguire linee guida di conservazione
Il pane si raffredda troppo velocemente,Conservare in sacchetti chiusi e in luogo fresco
Il pane ha odore insolito dopo trasporto,Non consumare e seguire linee guida di sicurezza
Il pane è arrivato danneggiato,Documentare il danno e seguire procedure interne
Il pane ha crosta troppo dura,Regolare temperatura e tempo di tostatura
Il pane si sfalda durante il trasporto,Documentare e seguire linee guida
Il pane non mantiene fragranza,Chiudere bene e conservare in luogo fresco
Il pane è troppo salato,Usare in ricette salate o tagliare fette sottili
Il pane ha consistenza troppo friabile,Manipolare delicatamente e conservare correttamente
Il pane si attacca alla confezione,Separare e conservare correttamente
Il pane ha odore strano dopo scongelamento,Non consumare e seguire procedure interne
Il pane non è uniforme tra pezzi,Considerare variabilità naturale
Il pane si rompe durante la cottura,Verificare tempi e temperatura di cottura
Il pane è troppo compatto,Affettare con cura e seguire istruzioni
Il pane ha sapore diverso dal solito,Verificare lotto e ingredienti
Il pane contiene semi non previsti,Segnalare discrepanza e seguire linee guida
Il pane perde aroma velocemente,Chiudere bene e conservare correttamente
Il pane si sfalda quando lo si tosta,Regolare tempo e temperatura
Il pane è troppo duro per la masticazione,Tagliare fette sottili o tostare leggermente
Il pane ha odore sgradevole,Non consumare e seguire procedure interne
Il pane si attacca tra fette,Separare e conservare correttamente
Il pane è arrivato piegato,Documentare e seguire linee guida
Il pane ha consistenza diversa tra lotti,Verificare lotto e usare normalmente
Il pane si rompe durante trasporto,Documentare e seguire linee guida
Il pane è troppo morbido,Seguire linee guida di conservazione
Il pane ha odore insolito,Non consumare e seguire procedure interne
Il pane si sfalda durante affettatura,Affettare con cura e conservare correttamente
Il pane è arrivato con muffa,Non consumare e seguire procedure interne
Il pane non tosta uniformemente,Regolare tempo e temperatura
Il pane ha sapore diverso dai lotti precedenti,Verificare lotto e ingredienti
Il pane è troppo secco per preparazioni,Usare in ricette che richiedono pane secco o tostarlo leggermente
Il pane si attacca tra le fette dopo apertura,Separare e conservare correttamente
Il pane ha consistenza irregolare,Verificare lotto e specifiche
Il pane si rompe facilmente durante il trasporto,Documentare e seguire procedure interne
Il pane è troppo morbido per preparazioni,Regolare tempo e temperatura
Il pane ha odore sgradevole,Non consumare e seguire procedure interne
Il pane perde fragranza rapidamente,Chiudere bene e conservare correttamente
Il pane si sfalda durante cottura,Regolare tempo e temperatura di cottura
Il pane è troppo duro per affettare,Affettare con cura
Il pane ha sapore amaro,Verificare lotto e usare solo in ricette appropriate
Il pane si deforma durante trasporto,Documentare e seguire linee guida
Il pane non mantiene fragranza,Chiudere bene e conservare in luogo fresco
Il pane ha odore diverso tra lotti,Verificare lotto e condizioni di produzione
Il pane si sfalda quando tostato,Regolare tempo e temperatura
Il pane è troppo compatto,Affettare con cura
Il pane si attacca tra le fette,Separare e conservare correttamente
Il pane ha consistenza diversa,Verificare lotto e specifiche
Il pane si rompe facilmente,Manipolare delicatamente e conservare correttamente
Il pane ha crosta troppo dura,Regolare temperatura e tostatura
Il pane si sfalda durante il trasporto,Documentare e seguire linee guida
Il pane non mantiene fragranza,Chiudere bene e conservare in luogo fresco
Il pane è troppo salato,Usare in ricette salate o tagliare fette sottili
Il pane ha consistenza troppo friabile,Manipolare delicatamente e conservare correttamente
Il pane si attacca alla confezione,Separare e conservare correttamente
Il pane ha odore strano dopo scongelamento,Non consumare e seguire procedure interne
Il pane non è uniforme tra pezzi,Considerare variabilità naturale
Il pane si rompe durante la cottura,Verificare tempi e temperatura di cottura
Il pane è troppo compatto,Affettare con cura e seguire istruzioni
Il pane ha sapore diverso dal solito,Verificare lotto e ingredienti
Il pane è troppo salato,Usare in ricette salate o tagliare fette sottili
Il pane è troppo secco,Conservare in sacchetti ben chiusi in luogo fresco
Il pane è troppo morbido,Regolare tempo e temperatura di tostatura
Il pane si è ammuffito,Non consumare e seguire le procedure di sicurezza
Il pane ha odore strano,Non consumare e seguire le procedure interne
Il pane ha crosta dura,Tagliare fette sottili o tostare leggermente
Il pane ha crosta morbida,Seguire istruzioni di conservazione
Il pane si sfalda,Manipolare delicatamente e conservare correttamente
Il pane perde fragranza,Chiudere bene e conservare in luogo fresco
Il pane ha sapore diverso,Verificare lotto e ingredienti
Il pane è arrivato piegato,Documentare il danno e seguire procedure interne
Il pane si rompe durante affettatura,Affettare con cura e conservare correttamente
Il pane è troppo compatto,Affettare con cura e seguire istruzioni
Il pane si attacca tra le fette,Separare le fette e conservare correttamente
Il pane è troppo molle per tostatura,Regolare tempo e temperatura
Il pane ha odore acido,Non consumare e seguire le procedure interne
Il pane perde aroma velocemente,Chiudere bene e conservare correttamente
Il pane si deforma durante il trasporto,Documentare e seguire procedure interne
Il pane è troppo friabile,Manipolare delicatamente e conservare correttamente
Il pane non mantiene fragranza dopo apertura,Chiudere bene e conservare in luogo fresco
Il pane ha sapore insolito,Verificare lotto e ingredienti
Il pane si sfalda durante il trasporto,Documentare e seguire procedure interne
Il pane ha consistenza diversa tra lotti,Verificare lotto e usare normalmente
